{
  "$schema": "https://opensource.adobe.com/spectrum-design-data/schemas/v0/component.schema.json",
  "$id": "https://opensource.adobe.com/spectrum-design-data/schemas/v0/components/form-item.json",
  "specVersion": "1.0.0-draft",
  "name": "form-item",
  "displayName": "Form item",
  "description": "Layout wrapper pairing a form field with its label and helper text.",
  "meta": {
    "category": "inputs",
    "documentationUrl": "https://spectrum.adobe.com/"
  },
  "lifecycle": { "introduced": "1.0.0-draft" }
}
