{
  "$schema": "https://opensource.adobe.com/spectrum-design-data/schemas/v0/component.schema.json",
  "$id": "https://opensource.adobe.com/spectrum-design-data/schemas/v0/components/tooltip.json",
  "specVersion": "1.0.0-draft",
  "name": "tooltip",
  "displayName": "Tooltip",
  "description": "Tooltips show contextual help or information about specific components when a user hovers or focuses on them.",
  "meta": {
    "category": "feedback",
    "documentationUrl": "https://spectrum.adobe.com/page/tooltip/"
  },
  "options": {
    "label": {
      "type": "string"
    },
    "variant": {
      "type": "string",
      "enum": ["neutral", "informative", "negative"],
      "default": "neutral"
    },
    "hasIcon": {
      "type": "boolean",
      "description": "If the neutral variant, there is never an icon.",
      "default": false
    },
    "maxWidth": {
      "type": "number",
      "default": 160,
      "description": "units: pixels"
    },
    "placement": {
      "type": "string",
      "enum": ["top", "bottom", "left", "right"],
      "default": "top"
    },
    "shouldFlip": {
      "type": "boolean",
      "default": false
    },
    "offset": {
      "type": "number",
      "default": 4,
      "description": "units: pixels"
    },
    "containerPadding": {
      "type": "number",
      "default": 8,
      "description": "units: pixels"
    }
  },
  "lifecycle": {
    "introduced": "1.0.0-draft"
  }
}
