{
  "$schema": "https://opensource.adobe.com/spectrum-design-data/schemas/v0/component.schema.json",
  "$id": "https://opensource.adobe.com/spectrum-design-data/schemas/v0/components/bar-panel.json",
  "specVersion": "1.0.0-draft",
  "name": "bar-panel",
  "displayName": "Bar panel",
  "description": "A panel anchored to an edge, exposing a draggable gripper for resizing.",
  "meta": {
    "category": "containers",
    "documentationUrl": "https://spectrum.adobe.com/"
  },
  "anatomy": [{ "name": "gripper" }],
  "lifecycle": { "introduced": "1.0.0-draft" }
}
