{
  "$schema": "https://opensource.adobe.com/spectrum-design-data/schemas/v0/component.schema.json",
  "$id": "https://opensource.adobe.com/spectrum-design-data/schemas/v0/components/menu.json",
  "specVersion": "1.0.0-draft",
  "name": "menu",
  "displayName": "Menu",
  "description": "Menus help users take actions, choose from a list of options, configure settings, and more. They can be placed in a transient container, like a popover or tray.",
  "meta": {
    "category": "actions",
    "documentationUrl": "https://spectrum.adobe.com/page/menu/"
  },
  "options": {
    "container": {
      "type": "string",
      "enum": ["popover", "tray"]
    },
    "label": {
      "type": "string"
    },
    "icon": {
      "$ref": "https://opensource.adobe.com/spectrum-design-data/schemas/types/workflow-icon.json",
      "description": "Icon must be present if the label is not defined."
    },
    "description": {
      "type": "string"
    },
    "value": {
      "type": "string"
    },
    "size": {
      "type": "string",
      "enum": ["s", "m", "l", "xl"],
      "default": "m"
    },
    "selectionMode": {
      "type": "string",
      "enum": ["single", "multiple", "no selection"]
    },
    "selectionStyle": {
      "type": "string",
      "enum": ["checkbox", "switch"]
    },
    "sectionHeader": {
      "type": "string"
    },
    "isCollapsible": {
      "type": "boolean",
      "default": false
    },
    "isUnavailable": {
      "type": "boolean",
      "default": false
    },
    "isDisabled": {
      "type": "boolean",
      "default": false
    }
  },
  "states": [
    {
      "name": "hover",
      "trigger": "interaction"
    },
    {
      "name": "down",
      "trigger": "interaction"
    },
    {
      "name": "keyboard-focus",
      "trigger": "interaction"
    }
  ],
  "lifecycle": {
    "introduced": "1.0.0-draft"
  }
}
