{
  "$schema": "https://opensource.adobe.com/spectrum-design-data/schemas/v0/component.schema.json",
  "$id": "https://opensource.adobe.com/spectrum-design-data/schemas/v0/components/breadcrumbs.json",
  "specVersion": "1.0.0-draft",
  "name": "breadcrumbs",
  "displayName": "Breadcrumbs",
  "description": "Breadcrumbs show hierarchy and navigational context for a user’s location within an app.",
  "meta": {
    "category": "navigation",
    "documentationUrl": "https://spectrum.adobe.com/page/breadcrumbs/"
  },
  "options": {
    "isMultiline": {
      "type": "boolean",
      "default": false,
      "description": "If true, the breadcrumb items will wrap to multiple lines."
    },
    "size": {
      "type": "string",
      "enum": ["m", "l"],
      "default": "m",
      "description": "Controls the overall size of the breadcrumb component."
    },
    "items": {
      "type": "array",
      "description": "An array of breadcrumb items.",
      "items": {
        "type": "object",
        "properties": {
          "label": {
            "type": "string",
            "description": "The text displayed for the breadcrumb item."
          },
          "href": {
            "type": "string",
            "description": "Optional URL the breadcrumb item links to."
          },
          "isCurrent": {
            "type": "boolean",
            "description": "Indicates if the breadcrumb item represents the current page.",
            "default": false
          },
          "isDisabled": {
            "type": "boolean",
            "default": false
          }
        },
        "required": ["label"]
      }
    },
    "separator": {
      "type": "string",
      "enum": ["chevron", "none"],
      "default": "chevron",
      "description": "The separator icon used between breadcrumb items."
    },
    "isTruncated": {
      "type": "boolean",
      "default": false,
      "description": "If true, the breadcrumb item is truncated and displayed as icon only."
    },
    "sizeOverride": {
      "type": "string",
      "enum": ["s", "m", "l", "xl"],
      "description": "Overrides the size of the breadcrumb items when isMultiline is true."
    }
  },
  "states": [
    {
      "name": "hover",
      "trigger": "interaction"
    },
    {
      "name": "down",
      "trigger": "interaction"
    },
    {
      "name": "keyboard-focus",
      "trigger": "interaction"
    },
    {
      "name": "drag-and-drop",
      "trigger": "prop"
    }
  ],
  "lifecycle": {
    "introduced": "1.0.0-draft"
  }
}
