{
  "$schema": "https://opensource.adobe.com/spectrum-design-data/schemas/v0/component.schema.json",
  "$id": "https://opensource.adobe.com/spectrum-design-data/schemas/v0/components/swatch-group.json",
  "specVersion": "1.0.0-draft",
  "name": "swatch-group",
  "displayName": "Swatch group",
  "description": "A swatch group is a grouping of swatches that are related to each other.",
  "meta": {
    "category": "inputs",
    "documentationUrl": "https://spectrum.adobe.com/page/swatch-group/"
  },
  "options": {
    "size": {
      "type": "string",
      "enum": ["xs", "s", "m", "l"],
      "default": "m"
    },
    "density": {
      "type": "string",
      "enum": ["compact", "regular", "spacious"],
      "default": "regular"
    },
    "enableSelection": {
      "type": "boolean",
      "default": false
    },
    "selectionMode": {
      "type": "string",
      "description": "Only applicable if selection is enabled.",
      "enum": ["single", "multiple"],
      "default": "single"
    },
    "allowsEmptySelection": {
      "type": "boolean",
      "default": false,
      "description": "Only applicable if selection is enabled."
    },
    "cornerRadius": {
      "type": "string",
      "enum": ["none", "full", "partial"],
      "default": "none",
      "description": "Determines the corner radius of each swatch in the group. Partial refers to corner-radius-75."
    }
  },
  "lifecycle": {
    "introduced": "1.0.0-draft"
  }
}
